{
  "run_id": "run-dev-001",
  "schema_version": "0.1",
  "created_at_utc": "2026-06-16T00:00:00Z",
  "scenario_id": "fixture-aster-heat-alarm",
  "run_mode": "dev",
  "simulation_seed": 42,
  "contract_version": "0.1",
  "tracks": [
    {
      "track_id": "track-artifacts",
      "role": "contract_fixture",
      "artifact_refs": [
        {
          "ref_id": "artifact-run-manifest-001",
          "ref_type": "run_manifest",
          "artifact_uri": "fixtures://run-manifest.json"
        }
      ]
    }
  ],
  "status": "planned"
}
